{
  "ibex_conflict_explanation_study": "h004",
  "schema_version": 1,
  "capture": {
    "algorithm": "lalr",
    "mode": "extended",
    "search_bounds": {
      "max_tokens": 16,
      "max_configurations": 100000
    },
    "repair_bounds": {
      "max_candidates": 32,
      "max_builds": 32,
      "equiv_max_tokens": 12,
      "equiv_max_configurations": 50000,
      "equiv_samples": 10,
      "verify_max_states": 100000,
      "verify_max_items": 1000000
    },
    "executes_grammar_actions": false
  },
  "coverage": {
    "case_count": 4,
    "conflict_count": 5,
    "shapes": [
      "ambiguous_expression",
      "dangling_optional_clause",
      "lr1_not_lalr_merge",
      "reduce_reduce_choice"
    ],
    "conflict_types": [
      "reduce_reduce",
      "shift_reduce"
    ],
    "witness_kinds": [
      "nonunifying_witness",
      "unifying_counterexample"
    ]
  },
  "cases": [
    {
      "id": "H004-EXPR",
      "shape": "ambiguous_expression",
      "grammar": {
        "path": "test/fixtures/conflict_explanations/expression.y",
        "sha256": "20046e2f14f85da56f65e85981c0d29d26c0dfb6e57d139c9fe07ee4b8c98b9e",
        "bytes": 143
      },
      "maintainer_hypothesis": {
        "cause": "missing operator associativity",
        "repair_goal": "choose and declare the intended PLUS associativity"
      },
      "automaton": {
        "algorithm": "lalr1",
        "state_count": 6,
        "digest": "c8405e1c2a861dcebf17eb72b5f481ebd538f8e8c5ff11c76d0193b3287d617d",
        "conflict_summary": {
          "sr": 1,
          "resolved_sr": 0,
          "rr": 0,
          "expected_sr": 1,
          "expectation_met": true
        }
      },
      "conflicts": [
        {
          "explanation": {
            "state": 5,
            "type": "shift_reduce",
            "token": {
              "name": "PLUS",
              "display_name": null,
              "label": "PLUS"
            },
            "alternatives": [
              {
                "kind": "shift",
                "state": 4
              },
              {
                "kind": "reduce",
                "production": 1
              }
            ],
            "resolution": {
              "by": "default_shift",
              "chose": "shift"
            },
            "witness": {
              "kind": "unifying_counterexample",
              "sentence": [
                {
                  "name": "NUM",
                  "display_name": null,
                  "label": "NUM"
                },
                {
                  "name": "PLUS",
                  "display_name": null,
                  "label": "PLUS"
                },
                {
                  "name": "NUM",
                  "display_name": null,
                  "label": "NUM"
                },
                {
                  "name": "PLUS",
                  "display_name": null,
                  "label": "PLUS"
                },
                {
                  "name": "NUM",
                  "display_name": null,
                  "label": "NUM"
                }
              ],
              "lookahead_index": 3,
              "symbol_path": [],
              "search": {
                "status": "found",
                "explored": 30,
                "exhausted": false,
                "bounds": {
                  "max_tokens": 16,
                  "max_configurations": 100000
                }
              },
              "interpretations": [
                {
                  "kind": "shift",
                  "tree": {
                    "symbol": {
                      "name": "start",
                      "display_name": null,
                      "label": "start"
                    },
                    "production": 0,
                    "children": [
                      {
                        "symbol": {
                          "name": "expression",
                          "display_name": null,
                          "label": "expression"
                        },
                        "production": 1,
                        "children": [
                          {
                            "symbol": {
                              "name": "expression",
                              "display_name": null,
                              "label": "expression"
                            },
                            "production": 2,
                            "children": [
                              {
                                "symbol": {
                                  "name": "NUM",
                                  "display_name": null,
                                  "label": "NUM"
                                },
                                "token": {
                                  "name": "NUM",
                                  "display_name": null,
                                  "label": "NUM"
                                }
                              }
                            ]
                          },
                          {
                            "symbol": {
                              "name": "PLUS",
                              "display_name": null,
                              "label": "PLUS"
                            },
                            "token": {
                              "name": "PLUS",
                              "display_name": null,
                              "label": "PLUS"
                            }
                          },
                          {
                            "symbol": {
                              "name": "expression",
                              "display_name": null,
                              "label": "expression"
                            },
                            "production": 1,
                            "children": [
                              {
                                "symbol": {
                                  "name": "expression",
                                  "display_name": null,
                                  "label": "expression"
                                },
                                "production": 2,
                                "children": [
                                  {
                                    "symbol": {
                                      "name": "NUM",
                                      "display_name": null,
                                      "label": "NUM"
                                    },
                                    "token": {
                                      "name": "NUM",
                                      "display_name": null,
                                      "label": "NUM"
                                    }
                                  }
                                ]
                              },
                              {
                                "symbol": {
                                  "name": "PLUS",
                                  "display_name": null,
                                  "label": "PLUS"
                                },
                                "token": {
                                  "name": "PLUS",
                                  "display_name": null,
                                  "label": "PLUS"
                                }
                              },
                              {
                                "symbol": {
                                  "name": "expression",
                                  "display_name": null,
                                  "label": "expression"
                                },
                                "production": 2,
                                "children": [
                                  {
                                    "symbol": {
                                      "name": "NUM",
                                      "display_name": null,
                                      "label": "NUM"
                                    },
                                    "token": {
                                      "name": "NUM",
                                      "display_name": null,
                                      "label": "NUM"
                                    }
                                  }
                                ]
                              }
                            ]
                          }
                        ]
                      }
                    ]
                  },
                  "state": 4
                },
                {
                  "kind": "reduce",
                  "tree": {
                    "symbol": {
                      "name": "start",
                      "display_name": null,
                      "label": "start"
                    },
                    "production": 0,
                    "children": [
                      {
                        "symbol": {
                          "name": "expression",
                          "display_name": null,
                          "label": "expression"
                        },
                        "production": 1,
                        "children": [
                          {
                            "symbol": {
                              "name": "expression",
                              "display_name": null,
                              "label": "expression"
                            },
                            "production": 1,
                            "children": [
                              {
                                "symbol": {
                                  "name": "expression",
                                  "display_name": null,
                                  "label": "expression"
                                },
                                "production": 2,